{
  "template_kind": "gd-plan-review",
  "reviewer": "codex",
  "review_target": "/Users/praise/.claude/plans/serialized-inventing-biscuit.md",
  "review_kind": "plan",
  "review_run_status": "completed",
  "gd_review_decision": "REQUIRES_CHANGES",
  "scope_checked": [
    {
      "facet": "raw markdown structure",
      "result": "pass",
      "evidence": "writer-validated; verdict=REQUIRES_CHANGES"
    }
  ],
  "findings": [
    {
      "severity": "P1",
      "title": "SC-03 与 SC-07 的默认行为验收互相冲突",
      "sc_refs": [
        "SC-03",
        "SC-07"
      ],
      "evidence": "`/Users/praise/.claude/plans/serialized-inventing-biscuit.md:64` 要求同 provider backoff；`:72-73` 要求单值严格等价旧行为；`:145-146` 又声明单 provider “无同 provider backoff”；`:166` 要求 env 全空对照旧行为。",
      "impact": "实施后 SC-03 和 SC-07 至少一个失败，provider 轮换正确性无法判定，后续 live 部署可能带着未定义的 0 回归语义推进。",
      "required_fix": "明确二选一：要么 SC-07 改为“除有意新增 backoff 外等价”，并同步修改 `:145-146/:166`；要么将默认 `CODEX_RETRY_BACKOFF=0`，只在显式配置或多 provider 同 provider 重试时启用 backoff。",
      "verify": "重新审查 SC-03/SC-07 文案与 Step 2 verify，确认同一默认配置下的 backoff 期望只有一个，并能被 fake-codex 计时测试断言。"
    }
  ],
  "merge_notes": {
    "conflict_with_other_reviewer": false
  },
  "residual_risk": [],
  "timestamp": "2026-06-05T10:20:18Z"
}