{
  "template_kind": "gd-plan-review",
  "reviewer": "codex",
  "review_target": "/Users/praise/AI-Agent/Claude/projects/Project GD/.claude/worktrees/plugin-packaging-plan/plans/gd/2026-06-11-plugin-packaging/track-a/step-plan.md",
  "review_kind": "plan",
  "review_run_status": "degraded",
  "gd_review_decision": "FAILED",
  "scope_checked": [
    {
      "facet": "raw markdown structure",
      "result": "pass",
      "evidence": "writer-validated; verdict=APPROVED"
    }
  ],
  "findings": [],
  "merge_notes": {
    "conflict_with_other_reviewer": false,
    "degraded_reason": "L3 content-evidence validator rejected review: ERROR: FAKE_EVIDENCE_DETECTED: APPROVED verdict — SCOPE_CHECKED section has no SC-IDs\nL3_RESULT: FAKE_EVIDENCE_DETECTED (1 error(s), verdict=APPROVED)"
  },
  "residual_risk": [],
  "timestamp": "2026-06-10T20:51:46Z"
}