{
  "template_kind": "gd-plan-review",
  "reviewer": "codex",
  "review_target": "/Users/praise/.claude/plans/serialized-inventing-biscuit.md",
  "review_kind": "plan",
  "review_run_status": "completed",
  "gd_review_decision": "APPROVED",
  "scope_checked": [
    {
      "facet": "raw markdown structure",
      "result": "pass",
      "evidence": "writer-validated; verdict=APPROVED"
    }
  ],
  "findings": [],
  "merge_notes": {
    "conflict_with_other_reviewer": false
  },
  "residual_risk": [],
  "timestamp": "2026-06-05T10:25:18Z"
}