{
  "template_kind": "gd-plan-review",
  "reviewer": "codex",
  "review_target": "fixtures/plans/sample-plan.md",
  "review_kind": "plan",
  "review_run_status": "failed_to_run",
  "gd_review_decision": "FAILED",
  "scope_checked": [
    {"facet": "sidecar runtime", "result": "fail", "evidence": "codex 超时 (>240s)"}
  ],
  "findings": [],
  "merge_notes": {
    "conflict_with_other_reviewer": false,
    "degraded_reason": "codex CLI 超时，无可解析输出"
  },
  "residual_risk": [],
  "timestamp": "2026-05-11T08:03:00Z"
}
