{
  "template_kind": "gd-plan-review",
  "reviewer": "codex",
  "review_target": "/Users/praise/AI-Agent/Claude/projects/Project GD/plans/gd/2026-06-16-fix-review-chain-bugs/master-plan.md",
  "review_kind": "plan",
  "review_run_status": "completed",
  "gd_review_decision": "REQUIRES_CHANGES",
  "scope_checked": [
    {
      "facet": "raw markdown structure",
      "result": "pass",
      "evidence": "writer-validated; verdict=REQUIRES_CHANGES"
    }
  ],
  "findings": [
    {
      "severity": "P1",
      "title": "SC-1 的验收命令不能证明 exit 1",
      "sc_refs": [
        "SC-1",
        "SC-1",
        "SC-1"
      ],
      "evidence": "`plans/gd/2026-06-16-fix-review-chain-bugs/master-plan.md:38`",
      "impact": "实现仍可用其他写法返回 0，而计划验收通过，L3 bridge active path 继续放水。",
      "required_fix": "给 SC-1 增加一个真实 fixture/命令，运行 `gd-codex-bridge-review.py` 产生 `REQUIRES_CHANGES` mapped result，并断言进程 exit 1。",
      "verify": "执行新增命令时 stdout/结果为 `REQUIRES_CHANGES`，shell returncode 为 1。"
    },
    {
      "severity": "P1",
      "title": "SC-2~SC-11 的逐项验收依赖外部 proposal",
      "sc_refs": [
        "SC-2",
        "SC-11",
        "SC-1",
        "SC-11",
        "SC-1",
        "SC-11"
      ],
      "evidence": "`plans/gd/2026-06-16-fix-review-chain-bugs/master-plan.md:123-132`",
      "impact": "`/gd execute` 后续可按 master plan 执行 smoke，但漏掉单项 fail-closed 断言，成功标准无法客观验收。",
      "required_fix": "在 master plan 的测试计划中按 SC-1~SC-11 逐条列出命令/fixture/输出断言；可引用 proposal，但必须给出确定路径和命令。",
      "verify": "逐条检查 SC-1~SC-11，每条都有本文件内可执行命令或明确 path+输出断言。"
    }
  ],
  "merge_notes": {
    "conflict_with_other_reviewer": false
  },
  "residual_risk": [],
  "timestamp": "2026-06-16T06:23:24Z"
}