{
  "template_kind": "gd-plan-review",
  "reviewer": "codex",
  "review_target": "fixtures/plans/sample-plan.md",
  "review_kind": "plan",
  "review_run_status": "completed",
  "gd_review_decision": "APPROVED",
  "scope_checked": [
    {"facet": "目标链完整性", "result": "pass", "evidence": "Codex 独立确认目标链"},
    {"facet": "SC 验收路径", "result": "pass", "evidence": "SC verify 命令可执行"}
  ],
  "findings": [],
  "merge_notes": {
    "conflict_with_other_reviewer": false
  },
  "residual_risk": [],
  "timestamp": "2026-05-11T08:01:00Z"
}
