{
  "template_kind": "gd-plan-review",
  "reviewer": "codex",
  "review_target": "/Users/praise/.claude/plans/serialized-inventing-biscuit.md",
  "review_kind": "plan",
  "review_run_status": "completed",
  "gd_review_decision": "REQUIRES_CHANGES",
  "scope_checked": [
    {
      "facet": "raw markdown structure",
      "result": "pass",
      "evidence": "writer-validated; verdict=REQUIRES_CHANGES"
    }
  ],
  "findings": [
    {
      "severity": "P2",
      "title": "默认讨论入口的 live 安装路径未闭合",
      "sc_refs": [
        "SC-01"
      ],
      "evidence": "`/Users/praise/.claude/plans/serialized-inventing-biscuit.md:119` 新建在 `vendor/l3-transport/scripts/codex-consult.sh`；`:133` 只写调用 `codex-consult.sh`；`:141` 写 live 仅部署 `~/.claude/handoff/bin/*` 且 consult 是“若放 handoff/bin”；`:185-186` 又写部署 vendored bin/lib/plist。",
      "impact": "按计划执行后，默认 `/review1` 可能调用不到 wrapper，导致 SC-01 active path 失败。",
      "required_fix": "指定唯一 live 路径，例如 `~/.claude/scripts/codex-consult.sh`；在 `install-transport.sh` 中明确从 `vendor/l3-transport/scripts/codex-consult.sh` 复制、chmod，并让 `commands/review1.md` 调用该绝对路径。",
      "verify": "`install-transport.sh --dry-run` 输出 source→dest 映射；部署后 `test -x ~/.claude/scripts/codex-consult.sh`；真跑 `/review1` 返回 `RECOMMENDATION:` 且 exit 0。"
    }
  ],
  "merge_notes": {
    "conflict_with_other_reviewer": false
  },
  "residual_risk": [],
  "timestamp": "2026-06-05T14:23:41Z"
}